objectid,filename,youtubeid,vimeoid,title,creator,date,description,object_transcript,subject,location,latitude,longitude,source,identifier,type,format,language,rights,rightsstatement
cots027,2024-11-9_andreachamberslytle_mckesson.mp4,vfpbKGRbVBI,,Andrea Chambers Lytle Oral History (2024),Appalachian State University; Leslie D. McKesson,2024-11-09,Andrea Chambers Lytle speaks with AppState students about her experiences as one of the first Black students to desegregate Burke County public schools.,,Andrea Chambers Lytle; desegregation; oral history; ,"Morganton, North Carolina",,,AppState Student Interview Collection,,Image; Moving Image; Sound,video/mp4,eng,This item is protected by copyright and/or related rights. Permission must be obtained for any use or reproduction which is not educational and not-for-profit. Contact the History Museum of Burke County with inquiries regarding use.,https://rightsstatements.org/page/InC-EDU/1.0/?language=en
cots028,2024-11-9_beverlycarlton_mckesson.mp4,CQfMR8_-WPs,,Beverly Carlton Oral History,Appalachian State University; Leslie D. McKesson,2024-11-09,Beverly Carlton speaks with AppState students about her experiences as one of the first Black students to desegregate Burke County public schools.,,Beverly Carlton; ,"Morganton, North Carolina",,,AppState Student Interview Collection,,Image; Moving Image; Sound,video/mp4,eng,This item is protected by copyright and/or related rights. Permission must be obtained for any use or reproduction which is not educational and not-for-profit. Contact the History Museum of Burke County with inquiries regarding use.,https://rightsstatements.org/page/InC-EDU/1.0/?language=en
cots029,2024-11-9_carollargent_mckesson.mp3,,,Carol Largent Oral History,Appalachian State University; Leslie D. McKesson,2024-11-09,Carol Largent speaks with AppState students about her experiences as one of the first Black students to desegregate Burke County public schools.,,Carol Largent; ,"Morganton, North Carolina",,,AppState Student Interview Collection,,Sound,audio/mp3,eng,This item is protected by copyright and/or related rights. Permission must be obtained for any use or reproduction which is not educational and not-for-profit. Contact the History Museum of Burke County with inquiries regarding use.,https://rightsstatements.org/page/InC-EDU/1.0/?language=en
cots030,2024-11-9_carolpoole_mckesson.mp3,,,Carol Poole Oral History,Appalachian State University; Leslie D. McKesson,2024-11-09,Carol Poole speaks with AppState students about her experiences as one of the first Black students to desegregate Burke County public schools.,,Carol Poole; ,"Morganton, North Carolina",,,AppState Student Interview Collection,,Sound,audio/mp3,eng,This item is protected by copyright and/or related rights. Permission must be obtained for any use or reproduction which is not educational and not-for-profit. Contact the History Museum of Burke County with inquiries regarding use.,https://rightsstatements.org/page/InC-EDU/1.0/?language=en
cots031,2024-11-9_charlesmckesson_mckesson.mp3,,,Charles McKesson Oral History,Appalachian State University; Leslie D. McKesson,2024-11-09,Charles McKesson speaks with AppState students about his experiences as one of the first Black students to desegregate Burke County public schools.,,Charles McKesson; ,"Morganton, North Carolina",,,AppState Student Interview Collection,,Sound,audio/mp3,eng,This item is protected by copyright and/or related rights. Permission must be obtained for any use or reproduction which is not educational and not-for-profit. Contact the History Museum of Burke County with inquiries regarding use.,https://rightsstatements.org/page/InC-EDU/1.0/?language=en
cots032,2024-11-9_diannthomastate_mckesson.mp4,XzaC9peChi0,,Diann Thomas Tate Oral History,Appalachian State University; Leslie D. McKesson,2024-11-09,Diann Thomas Tate speaks with AppState students about her experiences as one of the first Black students to desegregate Burke County public schools.,,Diann Thomas Tate; ,"Morganton, North Carolina",,,AppState Student Interview Collection,,Image; Moving Image; Sound,video/mp4,eng,This item is protected by copyright and/or related rights. Permission must be obtained for any use or reproduction which is not educational and not-for-profit. Contact the History Museum of Burke County with inquiries regarding use.,https://rightsstatements.org/page/InC-EDU/1.0/?language=en
cots033,2024-11-9_dorisfullwood_mckesson.mp3,,,Doris Fullwood Oral History,Appalachian State University; Leslie D. McKesson,2024-11-09,Doris Fullwood speaks with AppState students about her experiences of school desegregation in Burke County.,,Doris Fullwood; ,"Morganton, North Carolina",,,AppState Student Interview Collection,,Sound,audio/mp3,eng,This item is protected by copyright and/or related rights. Permission must be obtained for any use or reproduction which is not educational and not-for-profit. Contact the History Museum of Burke County with inquiries regarding use.,https://rightsstatements.org/page/InC-EDU/1.0/?language=en
cots034,2024-11-9_garyharbison_mckesson.mp4,BGhMHaw1Zxs,,Gary Harbison Oral History,Appalachian State University; Leslie D. McKesson,2024-11-09,Gary Harbison speaks with AppState students about his experiences as one of the first Black students to desegregate Burke County public schools.,,Gary Harbison; ,"Morganton, North Carolina",,,AppState Student Interview Collection,,Image; Moving Image; Sound,video/mp4,eng,This item is protected by copyright and/or related rights. Permission must be obtained for any use or reproduction which is not educational and not-for-profit. Contact the History Museum of Burke County with inquiries regarding use.,https://rightsstatements.org/page/InC-EDU/1.0/?language=en
cots035,2024-11-9_nancyphifer_mckesson.mp3,,,Nancy Phifer Oral History,Appalachian State University; Leslie D. McKesson,2024-11-09,Nancy Phifer speaks with AppState students about her experiences of school desegregation in Burke County.,,Nancy Phifer; ,"Morganton, North Carolina",,,AppState Student Interview Collection,,Sound,audio/mp3,eng,This item is protected by copyright and/or related rights. Permission must be obtained for any use or reproduction which is not educational and not-for-profit. Contact the History Museum of Burke County with inquiries regarding use.,https://rightsstatements.org/page/InC-EDU/1.0/?language=en
cots036,2024-11-9_pamgreene_mckesson.mp4,mGzmG8yBjNY,,Pam Greene Oral History,Appalachian State University; Leslie D. McKesson,2024-11-09,Pam Greene speaks with AppState students about her experiences of school desegregation in Burke County.,,Pam Greene; ,"Morganton, North Carolina",,,AppState Student Interview Collection,,Image; Moving Image; Sound,video/mp4,eng,This item is protected by copyright and/or related rights. Permission must be obtained for any use or reproduction which is not educational and not-for-profit. Contact the History Museum of Burke County with inquiries regarding use.,https://rightsstatements.org/page/InC-EDU/1.0/?language=en
cots037,2024-11-9_ritarankin_mckesson.mp3,,,Rita Rankin Oral History,Alexis Robinson; Ella Lowman; Hayden Zeagler; Appalachian State University; Leslie D. McKesson,2024-11-09,Rita Rankin speaks with AppState students about her experiences as one of the first Black students to desegregate Burke County public schools.,,Rita Rankin; Glen Alpine Elementary School; McAlpine School; mistreatment from teachers; family; Freedom High School; desegregation; Historically Black Colleges and Universities; Predominantly White Institutions; cheerleading; band; Woolworths; Downtown Morganton; presidential election; Glen Alpine; Drexel Furniture; Broughton; nursing; healthcare; joy; church,"Morganton, North Carolina",,,AppState Student Interview Collection,,Sound,audio/mp3,eng,This item is protected by copyright and/or related rights. Permission must be obtained for any use or reproduction which is not educational and not-for-profit. Contact the History Museum of Burke County with inquiries regarding use.,https://rightsstatements.org/page/InC-EDU/1.0/?language=en
cots038,2024-11-9_ruthroseboro_mckesson.mp3,,,Ruth Roseboro Oral History,Alexis Robinson; Appalachian State University; Leslie D. McKesson,2024-11-09,Ruth Roseboro speaks with AppState students about her experiences as one of the first Black students to desegregate Burke County public schools.,,Ruth Roseboro; Mountain View Elementary; desegregation; discrimination; Downtown Morganton; segregated water fountains; segregated restrooms; West Concord Mothers; transportation; racial violence; physical violence; harassment; Olive Hill High School; community; church; loss of Black teachers; extracurriculars; band; glee club; sports; resistance; student activism; walk out; NAACP; family; Woolworths; segregation; cheerleading,"Morganton, North Carolina",,,AppState Student Interview Collection,,Sound,audio/mp3,eng,This item is protected by copyright and/or related rights. Permission must be obtained for any use or reproduction which is not educational and not-for-profit. Contact the History Museum of Burke County with inquiries regarding use.,https://rightsstatements.org/page/InC-EDU/1.0/?language=en
cots039,2024-11-9_tommycarpenter_mckesson.mp3,,,Tommy Carpenter Oral History,Appalachian State University; Leslie D. McKesson,2024-11-09,Tommy Carpenter speaks with AppState students about his experiences as one of the first Black students to desegregate Burke County public schools.,,Tommy Carpenter; ,"Morganton, North Carolina",,,AppState Student Interview Collection,,Sound,audio/mp3,eng,This item is protected by copyright and/or related rights. Permission must be obtained for any use or reproduction which is not educational and not-for-profit. Contact the History Museum of Burke County with inquiries regarding use.,https://rightsstatements.org/page/InC-EDU/1.0/?language=en